X,Y,ACCESSION,PC,TEXT,TEXT_FR,ID,IMAGE,IMAGE_FR,CREDIT,LAT,LONG,ADDRESS,ADDRESS_FR,ARTWORK,ARTWORK_FR,ARTISTS,LOCATION,LOCATION_FR,CITY,PROVINCE,DATE_MOD,MATERIAL,MATERIAL_FR,YEAR,ObjectId
-8407385.72916804,5693596.51942184,2001-0256,K1C 4W2,"Wonder is the Beginning of Wisdom was created for the Gloucester Public Library (now the Orleans Branch) and represents the human desire to seek knowledge. Born in Montréal, Tim desClouds has a B.F.A. from York University and a B.Ed. from Queens University. In addition to his busy career as a sculptor and painter, desClouds was a visual arts instructor at Canterbury High School and a former board member for both the Ottawa Art Gallery and SAW Gallery. DesClouds has created site-specific artwork commissioned by the City of Ottawa for the Aberdeen Pavilion, Garry J. Armstrong Long Term Care Centre, Bank Street, Greely Village Park, and McNabb Park. He has exhibited in Ottawa, Stratford, and Toronto. His work can be found in the collections of the Canada Council Art Bank, the City of Ottawa and the City of Gatineau as well as numerous private collections.","L’œuvre Wonder is the Beginning of Wisdom (L’émerveillement est le début de la sagesse) a été créée pour la bibliothèque publique de Gloucester (Succursale d’Orléans). Elle représente la volonté d’accéder à la connaissance. Né à Montréal, Tim desClouds possède un baccalauréat en beaux-arts de l’Université York et un baccalauréat en éducation de l’Université Queens. En plus d’être un sculpteur et un peintre très occupé, il enseigne les arts visuels à l’école secondaire Canterbury et il a siégé au conseil d’administration de la Galerie d’art d’Ottawa et de la Galerie SAW. En réponse à une commande de la Ville d’Ottawa, M. desClouds a créé des œuvres pour le foyer de soins de longue durée Garry J. Armstrong, le pavillon Aberdeen, la rue Bank, le parc du village de Greely et le parc McNabb. Il a exposé à Ottawa, à Stratford et à Toronto. Certaines de ses œuvres font partie de la Banque d’art du Conseil des arts du Canada, des collections de la Ville d’Ottawa et de la Ville de Gatineau, ainsi que de nombreuses collections privées. ",PA35,https://ottawa.ca/sites/default/files/images/featured/2001-0256.jpg,https://ottawa.ca/sites/default/files/images/featured/2001-0256.jpg,,45.455995,-75.524831,1705 Orleans Blvd,"1705, boul Orleans",Wonder is the Beginning of Wisdom,Wonder is the Beginning of Wisdom,"desClouds, Tim","1705 Orleans Blvd, Ottawa Public Library, Orleans Branch ","1705 Orleans Blvd, Ottawa Public Library, Orleans Branch ",Ottawa,ON,20210118,painted steel and Galvalume pipe,acier et acier Galvalume peint,1995,48
-8425903.837781,5688168.48732564,2001-0257,K1J 7N8,"The Tree of Knowledge is a three-part clay tree with a trunk made of ceramic books. Rosemary Swan began working in clay in 1971 and founded the Gloucester Pottery School 20 years later, in 1991. After completing a degree in fine art, she began working on large murals such as this Raku triptych.","Cet arbre est constitué de trois morceaux d’argile et d’un tronc fait de livres en céramique. Rosemary Swan a commencé à travailler l’argile en 1971 et a fondé l’école de poterie de Gloucester vingt ans plus tard, en 1991. Après avoir obtenu un diplôme en beaux-arts, elle a commencé à travailler à de grandes murales telles que ce triptyque raku.",PA36,https://ottawa.ca/sites/default/files/images/featured/2001-0257.jpg,https://ottawa.ca/sites/default/files/images/featured/2001-0257.jpg,,45.421781,-75.691182,2036 Oglivie Rd,"2036, ch Oglivie",Tree of Knowledge,Tree of Knowledge,"Swan, Rosemary","2036 Oglivie Road, Ottawa Public Library, North Gloucester Branch","2036 Oglivie Road, Ottawa Public Library, North Gloucester Branch",Ottawa,ON,20210118,"ceramic, raku fired",céramique cuit au raku,1998,49
-8404359.73144981,5693979.46482468,2001-0278,K1B 5A3,Commissioned by the former City of Gloucester,Commandé par l'ancienne Ville de Gloucester.,PA37,https://ottawa.ca/sites/default/files/images/featured/2001-0278g.jpg,https://ottawa.ca/sites/default/files/images/featured/2001-0278g.jpg,,45.458408,-75.497648,200 Glen Park Dr,"200, prom Glen Park",Snow Birds-Face of our Community,Snow Birds-Face of our Community,"Ciesluk, Karl","200 Glen Park Drive, Blackburn Community Centre ","200 Glen Park Drive, Blackburn Community Centre ",Ottawa,ON,20210118,ceramic mosaic,mosaïque de céramique,,50
-8409760.17390666,5695129.19299422,2001-0287,K1C 2X8,"Created for the former City of Gloucester, these five figures celebrate health and fitness. Each figure is made of hammer-formed and welded sheet bronze. The figures’ hands and feet were moulded from the hands and feet of the artist’s friends and family.","Réalisés pour l’ancienne Ville de Gloucester, ces cinq personnages, faits de feuilles de bronze façonnées au marteau et soudées, célèbrent la santé et la forme physique. Leurs mains et leurs pieds ont été moulés sur ceux de proches de l’artiste.",PA38,https://ottawa.ca/sites/default/files/images/featured/2001-0287b.jpg,https://ottawa.ca/sites/default/files/images/featured/2001-0287b.jpg,,45.465652,-75.546161,1490 Youville Dr,"1490, prom Youville",Raising the Bar,Raising the Bar,"Smith, Diane",1490 Youville Drive Bob MacQuarrie Recreation Complex - Orléans ,1490 Youville Drive Bob MacQuarrie Recreation Complex - Orléans ,Ottawa,ON,20210118,bronze,bronze,2000,51
-8425015.39692497,5692402.8759893,2001-0318,K1P 5A1,"At age 21, Terry Fox set out on his Marathon of Hope to raise money for cancer research. He ran for 143 days, through the Atlantic provinces, Quebec and Ontario, before the bone cancer that had taken part of his right leg returned and forced him to stop near Thunder Bay. He died on June 28, 1981, a month before his 23rd birthday. His legacy continues to motivate people here in Canada and around the world. To date, over $650 million has been raised in support of Terry Fox's cause.","À 21 ans, Terry Fox a entrepris son Marathon de l’espoir afin de recueillir des fonds pour la recherche contre le cancer. Il a couru pendant 143 jours, traversant  les provinces de l’Atlantique, le Québec  et l’Ontario, avant que le cancer des os qui l’avait privé d’une partie de sa jambe droite resurgisse et le force à s’arrêter près de Thunder Bay. Il est mort le 28 juin 1981, un mois avant son 23e anniversaire. Son Marathon de l'espoir a inspiré un pays continue de motiver des individus ici au Canada et à l'échelle mondiale. À ce jour, plus de 650 millions de dollars on été recueillis pour soutenir la cause de Terry.",PA39,https://ottawa.ca/sites/default/files/images/featured/terryfox.jpg,https://ottawa.ca/sites/default/files/images/featured/terryfox.jpg,,45.448473,-75.683201,90 Wellington St,"90, rue Wellington",Terry Fox Memorial Sculpture ,Terry Fox Memorial Sculpture ,"Hooper, John",90 Wellington and Metcalfe - Department of Heritage (NCC),90 Wellington and Metcalfe - Department of Heritage (NCC),Ottawa,ON,20210118,bronze,bronze,1983,52
-8424920.66403831,5684752.072787,2001-0322,,,,PA328,,,,45.400236,-75.68235,955 Bank St,"955, rue Bank",Cows Fly Home on Sunday,Cows Fly Home on Sunday,"desClouds, Tim","955 Bank Street, Lansdowne Park Complex: Aberdeen Pavilion
","955 Bank Street, Lansdowne Park Complex: Aberdeen Pavilion
",Ottawa,ON,20210118,"steel, copper, aluminum","acier, cuivre et aluminium",1994,53
-8433581.32042203,5682940.76793773,2001-0323,K2A 4B1,"In mythology, the phoenix is a long-lived bird that perpetually cycles through birth and death. It was acquired by the Regional Municipality of Ottawa-Carleton and later transferred to the City of Ottawa. Its creator, Almuth Lütkenhaus-Lackey, studied art at schools in Dortmund and Münster in Germany. She lived in Germany until 1966, when she moved to Canada. A retrospective of her sculptural work was held at the National Arts Centre in 1974. Lütkenhaus-Lackey died in 1996.","Dans la mythologie, le phénix est un oiseau doté d’une grande longévité qui naît et meurt suivant un cycle perpétuel. L’œuvre a été acquise par la Municipalité régionale d’Ottawa-Carleton, puis transférée à la Ville d’Ottawa. Sa créatrice, Almuth Lütkenhaus-Lackey, a fait des études en arts dans des écoles de Dortmund et de Münster, en Allemagne. Elle a vécu dans ce pays jusqu’en 1966, puis s’est installée au Canada. Une rétrospective de son œuvre sculpturale a été présentée par le Centre national des Arts en 1974. L’artiste est décédée en 1996.",PA40,https://ottawa.ca/sites/default/files/images/featured/2001-0323.jpg,https://ottawa.ca/sites/default/files/images/featured/2001-0323.jpg,,45.38881,-75.76015,495 Richmond Rd,"495, ch Richmond",Phoenix Rising,Phoenix Rising,"Lutkenhaus-Lackey, Almuth",495 Richmond Road,495 Richmond Road,Ottawa,ON,20210118,bronze casting,fonte de bronze,1990,54
-8423292.83912444,5681386.88223364,2001-0325,,"This artwork comprises 200-square-feet of unglazed, fully vitrified clay tiles in rich, earthy tones. Although the imagery is abstract, it conveys a strong sense of movement and liveliness as visible in the right side of the mural which contains a concentration of orange and yellow tiles presented in a bold spiral with rays extending around it. Feindel wanted to express human and natural creativity and how they are intimately connected. There is a sense of both conflict and harmony in the work, seen through the disparity between the hectic lines of the composition which are executed in a soothing, earthy palette. The piece strongly suggests energy and movement, causing the viewer’s eye to wander around the entire work. The perceptive viewer will notice the artist’s signature in dark coloured tiles integrated into the composition and located in the bottom right hand corner.","Cette œuvre de Susan Feindel est composée de carreaux couleur terre vitrifiés mais non vernissés, de 18,5 mètres carrés. Malgré le style abstrait, l’œuvre produit une forte impression de mouvement et d’animation, particulièrement perceptible dans la partie droite de la fresque murale, vibrante d’une concentration de carreaux orange et jaunes agencés en une spirale puissante et irradiante. L’artiste a voulu exprimer la créativité de l’homme et de la nature et les liens intimes entre les deux. L’intensité des traits et la douceur de la palette expriment antagonisme et harmonie tout à la fois. L’énergie et le dynamisme qui s’en dégagent invitent le regard à parcourir tout l’ensemble. Lorsque l’on regarde attentivement, on peut noter, dans le coin inférieur droit, la signature de l’artiste en carreaux de couleurs sombres, intégrée à la composition.",PA41,https://ottawa.ca/sites/default/files/images/featured/photo_d_barbour_099_-_copy.jpg,https://ottawa.ca/sites/default/files/images/featured/photo_d_barbour_099_-_copy.jpg,,45.379006,-75.667727,OC Transitway Greenboro,Station Greenboro,Quarry Pillar,Quarry Pillar,"Feindel, Susan",OC Transitway Greenboro,OC Transitway Greenboro,Ottawa,ON,20210118,mosaic tile mural,murale en mosaic,1994,55
-8425868.10422445,5688179.11362301,2001-0327,K1P 1J1,"Originally planned as a theatrical stage set with props, this invented room provides a place for personal thinking and public observation. As visitors walk around and through The Living Room, a relationship between the participant's body and each object at the site begins. A doorway, some chairs, a window and a television have been positioned close together to replicate the intimacy of an interior space and to acknowledge the spatial limits of an urban environment. Visitors are encouraged to enter the scene and consider how ideas are formed by the events taking place in the outside world.

In 1991, Nickolas D. Semanyk and Jason Grant-Henley, both of whom studied architecture at Carleton University, formed a partnership and named it URBAN KEIOS.","Conçu à l’origine comme un décor de théâtre avec accessoires, ce salon imaginaire offre un espace pour la réflexion personnelle et l’observation publique. Une relation s’établit progressivement entre le corps des visiteurs qui déambulent dans Salon et chacun des objets du site. Une porte, des fauteuils, une fenêtre et un téléviseur ont été disposés à faible distance l’un de l’autre pour recréer l’intimité d’un espace intérieur et rendre compte des frontières spatiales d’un environnement urbain. Les visiteurs sont invités à entrer dans la scène et à réfléchir à l’incidence des événements du monde extérieur sur la formation des idées.

En 1991, Nickolas D. Semanyk et Jason Grant-Henley se sont associés sous le nom d’URBAN KEIOS. Tous deux ont étudié l’architecture à l’Université Carleton.",PA42,https://ottawa.ca/sites/default/files/images/featured/2001-0327.jpg,https://ottawa.ca/sites/default/files/images/featured/2001-0327.jpg,,45.421848,-75.690861,110 Laurier Ave W,"110, av Laurier O",The Living Room,The Living Room,URBAN KEIOS,"110 Laurier, City Hall commissions","110 Laurier, City Hall commissions",Ottawa,ON,20210118,aluminium ,aluminium ,1995,56
-8425299.03898751,5686685.52881466,2001-0328,K2P 2J6,"A striking example of documentary art, this mural depicts the faces and uniforms of Ottawa’s 15 police chiefs from 1855 to 1983. The police chiefs are surrounded by Ottawa landmarks such as Chaudière Falls, the Ottawa River and Rideau Falls. The final design was produced under the tightest of deadlines: its unveiling was set for the first royal visit from the newly married Charles and Diana, Prince and Princess of Wales, in June 1983. Artist Jerry Grey had to make a rush order for supplies and the tiles were flown in from Italy, arriving just  three weeks before the completion deadline. The task of washing, sorting and cutting 168,000 tiles and affixing them to the wall grid was shared by artists Susan Geraldine Taylor, Kiyomi Shoyama, Tildy Clemann and professional tile layer Vinko Dobaj. “We literally worked around the clock to complete the mural,” Grey said. “The people that worked for me—they really made a difference.”","Remarquable exemple d’art documentaire, cette murale dépeint les visages et les uniformes des 15 chefs de police d’Ottawa de 1855 à 1983; ils sont entourés de sites emblématiques d’Ottawa tels que les chutes de la Chaudière, la rivière des Outaouais et les chutes Rideau. L’œuvre a été réalisée à très courte échéance : son inauguration devait avoir lieu en juin 1983, lors de la première visite royale de Charles et Diana, prince et princesse de Galles nouvellement mariés. L’artiste Jerry Grey a commandé le matériel en urgence et les carreaux lui ont été envoyés d’Italie par avion; quand la commande est arrivée, il lui restait seulement trois semaines pour réaliser son œuvre. Il s’est donc fait aider des artistes Susan-Geraldine Taylor, Kiyomi Shoyama et Tildy Clemann ainsi que du carreleur professionnel Vinko Dobaj pour laver, trier et couper les 168 000 carreaux et les coller à la grille murale. « Nous avons littéralement travaillé nuit et jour pour terminer la murale. Mes collaborateurs m’ont vraiment été d’une grande aide », raconte Grey.",PA43,https://ottawa.ca/sites/default/files/images/featured/2001-0328.jpg,https://ottawa.ca/sites/default/files/images/featured/2001-0328.jpg,,45.41243,-75.685749,474 Elgin St,"474, rue Elgin",Tiles of Time (Les carreaux du temps),Tiles of Time (Les carreaux du temps),"Grey, Jerry","474 Elgin Street, Police Station","474 Elgin Street, Police Station",Ottawa,ON,20210118,"glass tiles, gold leaf tiles, silver plated buttons","carreaux en verre, carreaux dorés à la feuille d’or, boutons plaqués argent ",1983,57
-8425868.10422445,5688179.11362301,2001-0360,K1P 1J1,"This tapestry conveys an impression of the Ottawa, Rideau and Gatineau Rivers as portrayed on the Ottawa-Carleton regional flag and heraldic crest. The eleven panels, representing each of the previous municipalities of the region, evoke the movement and energy of the rivers and emulate the patterns of the furrowed fields. The material symbolizes the melding of silver and gold metallic to reflect the environmental elements of water, ice, snow and sun on the landscape through the seasons. Carole Sabiston, born in London, England, has lived in Victoria, British Columbia since 1952. She is a member of the Royal Canadian Academy and 1987 winner of the Saidye Bronfman Award for Canada for Excellence in Art.","Cette tapisserie symbolise les rivières Rideau, Gatineau et des Outaouais, représentées sur le drapeau et les armoiries de la région d’Ottawa-Carleton. Les onze pans représentent chacune des anciennes municipalités de la région et évoquent le mouvement et l’énergie des rivières ainsi que les motifs des champs. Les tissus allient l’argent et l’or pour représenter l’eau, la glace, la neige et le soleil dans les paysages des différentes saisons. Carole Sabiston, née à Londres, en Angleterre, vit à Victoria, en Colombie-Britannique, depuis 1952. Elle est membre de l’Académie royale des arts du Canada et a remporté en 1987 le Prix Saidye Bronfman pour l’excellence artistique au Canada.",PA45,https://ottawa.ca/sites/default/files/images/featured/rivers_reflecting.jpg,https://ottawa.ca/sites/default/files/images/featured/rivers_reflecting.jpg,,45.421848,-75.690861,110 Laurier Ave W,"110, av Laurier O",Rivers Reflecting Seasons,Rivers Reflecting Seasons,"Sabiston, Carole","110 Laurier, Teachers College, Meeting Rooms","110 Laurier, Teachers College, Meeting Rooms",Ottawa,ON,20210118,"multi synthetic fabric, machine bonded","tissus synthétique multiple,
rapiècé à la machine",1990,58
-8425868.10422445,5688179.11362301,2001-0361,K1P 1J1,"Drawing inspiration from the nautilus shell, Paula Murray created this work to celebrate the rhythmic energy paralleled in nature and society. The mathematically correct architecture of the symbolic spiral structure instills energy, strength, power, and unity into the work. Whether viewed from below on the first floor or at eye level from the second floor, Nautilus reveals an airy sense of movement with a continuous play of light and shadow. The lustrous and delicate appearance of the work is achieved through the use of translucent porcelain arcs, with each arc individually moulded and fired in an electric kiln to 2400 F to achieve translucency. Paula Murray is one of Canada's leading contemporary craft artists. Living in Gatineau Park on the shore of Meech Lake, Murray has been a studio potter for more than thirty years.","S'inspirant de la coquille en spirale du nautile, Paula Murray célèbre dans Nautilus le rythme simultané qui anime la nature et la société. La composition mathématiquement précise de la spirale symbolique déploie une énergie, une force et une unité remarquables dans l'œuvre. Vu d'en dessous du rez-de-chaussée ou sous l'angle normal au deuxième étage Nautilus révèle un sens aérien du mouvement grâce au jeu continu de la lumière et de l'ombre. L'aspect brillant et délicat de l'œuvre est obtenu par l'emploi d'arcs en porcelaine translucide. Chaque arc a été moulé séparément et cuit à 2 400 oF dans un four électrique pour obtenir la translucidité. Œuvrant dans son atelier de Chelsea (Québec), Paula Murray est une céramiste d'art depuis plus de vingt ans. Paula Murray est une des chefs de file des métiers d'art au Canada.",PA46,https://ottawa.ca/sites/default/files/images/featured/nautilus.jpg,https://ottawa.ca/sites/default/files/images/featured/nautilus.jpg,,45.421848,-75.690861,110 Laurier Ave W,"110, av Laurier O",Nautilus,Nautilus,"Murray, Paula","110 Laurier, City Hall commissions","110 Laurier, City Hall commissions",Ottawa,ON,20210118,"anodized aluminum, translucent ceramic","aluminium givré, céramique translucide",1990,59
-8425868.10422445,5688179.11362301,2001-0362,K1P 1J1,"Creating a welcome feeling of intimacy in the arcade, Family Portrait celebrates the individuals that comprise the 'regional family'.  Chosen for their diversity, contributions, and eccentricities, Brathwaite cast the faces of 28 individuals ranging from a spiked-haired student/photographer in Nepean to a farming husband and wife team in Kanata. These individuals reflect the spirit and character of their municipality and together create a time capsule. The municipalities represented here are Cumberland, Gloucester, Goulbourn, Kanata, Nepean, Osgoode, Ottawa, Rideau, Rockcliffe, Vanier and West Carleton. Born in Ottawa, Stephen Brathwaite is a well-respected glass artist who earned his BA at Carleton University, 1971. ","Introduisant une sensation bienvenue d’intimité dans la galerie, Portrait de famille rend hommage aux personnes qui font partie de la « famille régionale ». Brathwaite a moulé les visages de 28 personnes choisies pour leur contribution et leur excentricité, de l’étudiant photographe punk de Nepean au couple d’agriculteurs de Kanata. Ces personnes reflètent la diversité, l’esprit et le caractère de leur municipalité – Cumberland, Gloucester, Goulbourn, Kanata, Nepean, Osgoode, Ottawa, Rideau, Rockcliffe, Vanier et West Carleton –, et ensemble, ces visages constituent une capsule témoin. Natif d’Ottawa, Brathwaite est un artiste verrier bien considéré. Il a obtenu un baccalauréat ès arts de l’Université Carleton en 1971.",PA47,https://ottawa.ca/sites/default/files/images/featured/2001-0362.jpg,https://ottawa.ca/sites/default/files/images/featured/2001-0362.jpg,,45.421848,-75.690861,110 Laurier Ave W,"110, av Laurier O",Family Portrait,Family Portrait,"Brathwaite, Stephen","110 Laurier, City Hall commissions","110 Laurier, City Hall commissions",Ottawa,ON,20210118,glass and bronze casting,fonte de bronze et de verre,1992,60
-8425868.10422445,5688179.11362301,2001-0363,K1P 1J1,"To add a spirit of optimism to the place where people pay their municipal taxes, artist Jim Thomson proposed this statue assembly to be placed in the entrance of the Client Service Centre. The statues reference various mythological traditions and thematically correspond to the two-metre high vases upon which they are placed. The turtle's home on his back represents his history, experience and wisdom, and relates to his perch of archeological fragments. The black dog is the Trickster who tries to trick us into learning. He is governed by the same strict and solid rules as is the vase upon which he stands. The jeweled bowl, perched on a spiral of pure energy, is an icon for the conquest of the spirit. The dog and the turtle both gaze at the bowl, which basks them in the notion that they will forever be positioned on top of the world. Thomson was an established Ottawa ceramist who studied art in Thailand, Japan and at the Banff Centre for the Arts.","Pour ajouter une note d’optimisme à l’endroit où les gens paient leurs taxes municipales, l’artiste Jim Thomson a proposé ce groupe de sculptures pour l’entrée du Centre de service à la clientèle. Les sculptures font référence à diverses traditions mythologiques, et sont fidèles au thème des vases de deux mètres de haut sur lesquels elles sont placées. La carapace ou maison de la tortue représente son histoire, son expérience et sa sagesse, et est liée à son perchoir de fragments archéologiques. Le chien noir est le filou qui tente par la ruse de nous amener à apprendre. Il est régi par les mêmes règles strictes et solides que le vase sur lequel il se trouve. Le bol orné de pierreries, perché sur une spirale d’énergie pure, est l’emblème de la conquête de l’esprit. Le chien et la tortue regardent le bol, qui leur rappelle qu’ils resteront éternellement au sommet du monde. Thomson était un céramiste établi d’Ottawa; il a étudié l’art en Thaïlande, au Japon et au Centre des arts de Banff.",PA48,https://ottawa.ca/sites/default/files/images/featured/on_top_of_the_world.jpg,https://ottawa.ca/sites/default/files/images/featured/on_top_of_the_world.jpg,,45.421848,-75.690861,110 Laurier Ave W,"110, av Laurier O",On Top of the world,On Top of the world,"Thomson, Jim","110 Laurier, City Hall commissions","110 Laurier, City Hall commissions",Ottawa,ON,20210118,stoneware and concrete,poterie de grès et béton,1990,61
