X,Y,ACCESSION,PC,TEXT,TEXT_FR,ID,IMAGE,IMAGE_FR,CREDIT,LAT,LONG,ADDRESS,ADDRESS_FR,ARTWORK,ARTWORK_FR,ARTISTS,LOCATION,LOCATION_FR,CITY,PROVINCE,DATE_MOD,MATERIAL,MATERIAL_FR,YEAR,ObjectId
-8427588.1016767,5686281.64714944,2012-0199,,"The series Silk Road Flower Rain, commissioned for the Chinatown district, exhibits colourful glass forms representing abstracted flowers and raindrops; bamboo for longevity, chrysanthemum for good health, and pomegranate to ward off evil spirits. The deliberate choice of eight sculptures per series is auspicious as it represents luck and fortune in Chinese numerology.","La série Pluie de fleurs sur la route de la soie, commandée pour le Quartier chinois, arbore des formes colorées en verre représentant des fleurs et des gouttes de pluie abstraites, le bambou signifiant la longévité, le chrysanthème la santé et la grenade éloignant les mauvais esprits. De plus, le choix délibéré de huit sculptures par série est de bon augure, car, selon la numérologie chinoise, ce chiffre apporte chance et prospérité.",PA127,https://ottawa.ca/sites/default/files/images/featured/silkroad.jpg,https://ottawa.ca/sites/default/files/images/featured/silkroad.jpg,,45.409883,-75.706312,Somerset St W,rue Somerset O,Silk Road Flower Rain,Pluie de fleurs sur la route de la soie,"Lafontaine and/et Lotecki, Charlynne  and/et Ryan ",Somerset Street West (Chinatown),Somerset Street West (Chinatown),Ottawa,ON,20210118,aluminum and glass,aluminium et verre,2011,141
-8429399.04715292,5685643.7510191,2012-0200,,"On Somerset Street West towards Hintonburg, the series of sculptures entitled Morphology are formed as if windblown, with the glass elements evolving from a decorative seed pod to an open flower, signifying growth and revitalization. For this series the artists were inspired by the concept of morphology; the study of form and shape.","Dans la rue Somerset Ouest en allant vers Hintonburg, la série de sculptures intitulée Morphologie, ressemble à de l’air soufflé par le vent et comporte des formes en verre telles des gousses qui se transforment en fleurs épanouies, illustrant la croissance et la revitalisation. Pour cette série, les artistes ont été inspirés par le concept de la morphologie : l’étude des formes et des courbes.",PA128,https://ottawa.ca/sites/default/files/images/featured/morphology.jpg,https://ottawa.ca/sites/default/files/images/featured/morphology.jpg,,45.40586,-75.72258,Somerset St W,rue Somerset O,Morphology,Morphologie,"Lafontaine and/et Lotecki, Charlynne  and/et Ryan ","Somerset Street West
","Somerset Street West
",Ottawa,ON,20210118,aluminum and glass,aluminium et verre,2011,142
-8419641.55982642,5686130.05747586,2012-0201,K1G 5J1,"TRANSPOtting is comprised of 80 LED panels which are embedded in a sound wall. The visual experience of lights cycling different colours, intensities, and patterns through LED panels is cued from input from the OC Transpo bus schedule. As the first bus driver of the day leaves the terminal, the wall begins to pulse with a different colour for each bus route. As the number of buses at a given distance increases, the wall becomes brighter, an ever-flowing river of multicoloured lights. The activity continues to build and decline throughout the rush hours and lulls in the day. As the day winds down the intensity and light along the wall recedes until the final bus returns. The wall acts as a heat map of the bustling movement of buses throughout the city, captivating the public as they wait for their own bus to arrive and join the light network. Eos Lightmedia is a Vancouver based design company which creates immersive environments. They draw on over 25 years of national and international experience in architecture, themed attractions, exhibits, museums, presentation centres, and public art installations.","L'œuvre de commande TRANSPOtting en est une qui s'appuie sur divers médias et comprend 80 panneaux à DEL encastrés dans des murs acoustiques. L'expérience visuelle, où les diodes changent de couleur et d'intensité et tracent sans cesse de nouvelles formes, est activée par les données provenant des horaires d'autobus d'OC Transpo. Quand le premier chauffeur quitte le terminal et amorce sa journée, le mur comme à briller d'une couleur différente pour chaque trajet d'autobus. Au fur et à mesure que le nombre d'autobus dans une certaine section s'accroît, la luminosité du mur augmente et un flot ininterrompu de lumière multicolore se révèle. L'activité poursuit ses ascensions et ses déclins, témoignant des heures de pointe et des périodes d'accalmie qui marquent la journée. Quand une journée tire à sa fin, le nombre et l'intensité des lumières se résorbent jusqu'à ce que le dernier autobus rentre au bercail. Le mur nous permet donc de voir jusqu'à quel point les autobus fourmillent dans tous les coins de la ville. Il captivera les membres du public qui attendront non seulement l'arrivée véritable de leur autobus, mais aussi son apparition sur le réseau lumineux. Eos Lightmedia est une entreprise de design établie à Vancouver qui crée des environnements immersifs. Elle compte sur plus de 25 ans d'expérience nationale et internationale dans les domaines de l'architecture, des attractions thématiques, des expositions, des musées, des centres des congrès et des installations d'art public.",PA129,https://ottawa.ca/sites/default/files/images/featured/2012-0201.jpg,https://ottawa.ca/sites/default/files/images/featured/2012-0201.jpg,,45.408927,-75.634927,745 Industrial Ave,"745, av Industrial",TRANSPOtting,TRANSPOtting,,"745 Industrial Avenue, OC Transpo Bus Garage","745 Industrial Avenue, OC Transpo Bus Garage",Ottawa,ON,20210118,LED panels and software,panneaux DEL et logiciels,2008,143
-8400837.6940806,5693878.37072476,2013-0001,K4A 0X3,"Water introduces the force of nature to the built environment of the François Dupuis Recreation Centre through a visual exploration of water’s many moods and manifestations.  The artwork amplifies the experience of being at the pool and our relationship with water, while acknowledging the building’s activity and purpose. 

Inspired by the artist’s charcoal drawings, the aluminum panels incorporate large open spaces and abstracted patterns to create a dynamic composition, describing water’s movements and reflections as well as some of the life forms it sustains. 

Jennifer Stead has been depicting landscapes in her work for over twenty years. Her work is represented in various private, public and corporate collections in Canada.  Stead received her B.F.A. from the Nova Scotia College of Art and Design in Halifax and earned an M.F.A. at the University of Calgary. ","Eau fait entrer la force de la nature au centre récréatif François-Dupuis en explorant les différentes expressions et dispositions caractéristiques de l’eau. Cette œuvre, tout en soulignant les activités et les objectifs du centre aquatique, enrichit notre expérience de la piscine et notre relation avec l’eau.    

L’artiste s’est inspirée de dessins au fusain pour intégrer de larges espaces ouverts et des motifs abstraits aux panneaux en aluminium, afin de créer une composition dynamique qui décrit les mouvements et les reflets de l’eau, ainsi que quelques-unes des formes de vie qu’elle soutient.

Jennifer Stead peint des paysages depuis maintenant une vingtaine d’années. Ses œuvres se retrouvent dans diverses collections privées, publiques et d’entreprises partout au pays. Titulaire d’un baccalauréat en beaux-arts du Nova Scotia College of Arts and Design d’Halifax, elle possède également une maîtrise en beaux-arts de l’Université de Calgary. ",PA130,https://ottawa.ca/sites/default/files/images/featured/2013-0001a.jpg,https://ottawa.ca/sites/default/files/images/featured/2013-0001a.jpg,,45.457771,-75.466009,2263 Portobello Blvd,"2263, boul Portobello",Water,Eau,"Stead, Jennifer","2263 Portobello Boulevard, François Dupuis Pool","2263 Portobello Boulevard, François Dupuis Pool",Ottawa,ON,20210118,aluminum,aluminium,2011,144
-8431090.99209349,5661354.4125163,2013-0066,,"The 13-foot high cast aluminum sculpture sits atop the toboggan hill at Cambrian and Greenbank roads, balanced on one of its five points. As if fallen from the sky, the artwork creates a bridge between the immensity of the celestial universe and our place on earth. Falling Star will shimmer during the night from the hundreds of holes emanating light- making reference to the celestial bodies and constellations above.","La sculpture Étoile filante a fait l’objet d’une commande de la Ville d’Ottawa pour le parc Half Moon Bay à Barrhaven Sud. Se présentant sous la forme d’une sculpture en aluminium coulé d’une hauteur de 4 m (13 pi), l’étoile se dresse en haut de la colline pour glissades (rues Cambrian et Greenbank), en équilibre sur l’une de ses cinq branches. Comme si elle était tombée du ciel, l’étoile crée un pont entre l’immensité de l’univers et l’espace que nous occupons sur terre. Pendant la nuit, l’étoile brillera de ses milliers de petites ouvertures, d’où une lumière scintillante s’échappera, en hommage aux corps célestes et aux constellations flottant au dessus de nos têtes.",PA131,https://ottawa.ca/sites/default/files/images/featured/fallingstar.jpg,https://ottawa.ca/sites/default/files/images/featured/fallingstar.jpg,Image courtesy Dugan Maynard / Image : gracieuseté de Dugan Maynard,45.252462,-75.737779,2757 Grand Vista Circle,"2757, Grand Vista",Falling Star,Étoile filante,"Maynard, Don","2757 Grand Vista Circle, Half Moon Bay, Cambrian and Greenbank","2757 Grand Vista Circle, Half Moon Bay, Cambrian and Greenbank",Ottawa,ON,20210118,"aluminum, acrylic and LED","aluminium, acrylique et LED",2011,145
-8450260.0970886,5665960.43406096,2013-0067,,"This sculpture by artist Michael Kinghorn engages with the word “overhaul” in two ways:

A term frequently used by firefighters, overhaul refers to the stripping of walls and floors in order to search for trapped heat. Similarly, the layers of this sculpture gradually dissolve to reveal different textures and metals.
 
Overhauling can also refer to an act of restoration, specifically in Kinghorn’s overhauling of materials to create the structure. In a reflection of the sustainable design of the building, the majority of the materials were repurposed from discarded firefighting equipment, including stainless steel drawers from an old fire truck.
This project was made possible with the support and assistance of Ottawa Fire Services.","Cette sculpture de l’artiste Michael Kinghorn évoque deux significations du mot anglais overhaul :

Terme fréquemment utilisé par les pompiers, overhaul décrit l’enlèvement de murs et de planchers pour trouver de la chaleur emprisonnée. Dans le même ordre d’idées, les couches de cette sculpture disparaissent graduellement pour dévoiler différentes textures et divers métaux.
 
Le terme overhauling peut également faire référence à une remise en état; en ce qui concerne cette sculpture de Michael Kinghorn, il s’agit d’une remise en état de matériaux pour créer une structure. À l’image de la conception écologique de la construction, la plupart des matériaux ont été transformés à partir d’équipement de pompiers qui ne servait plus, dont des tiroirs en acier inoxydable qui provenaient d’un vieux camion de pompier.
La réalisation de ce projet a été possible grâce au soutien et à l’aide du Service des incendies d’Ottawa.",PA132,https://ottawa.ca/sites/default/files/images/featured/2013-0067a.jpg,https://ottawa.ca/sites/default/files/images/featured/2013-0067a.jpg,,45.281583,-75.909978,34 Iber Rd,"34, ch Iber",Overhaul,Overhaul,"Kinghorn, Michael","34 Iber Rd, Stittsville, Fire Station 46","34 Iber Rd, Stittsville, Fire Station 46",Ottawa,ON,20210118,"steel, brass, aluminum and rubber","acier, laiton, aluminium et caoutchouc",2012,146
-8430895.40374817,5661502.26324878,2013-0068,,"This sculpture by artist Michael Kinghorn reminds us of the dangerous conditions regularly faced by rescue workers. The open corner exposes a jumble of weathered gears, tilling blades, horseshoes and wagon wheels. The deteriorating structure is secured by stainless steel beams, representing the rescue work and support that firefighters offer. The majority of the materials used in the structure are recycled, including the found objects, which were largely sourced from old farms in the Gatineau Hills and neighbouring regions. The copper sign portrays the Urban Search and Rescue image, a caution warning to rescue teams entering a building. This sculpture is a monumental reminder of the risks taken and the impact made by fire services.

This project was made possible with the support and assistance of Ottawa Fire Services.","Cette sculpture de l’artiste Michael Kinghorn nous rappelle les conditions dangereuses que doivent souvent affronter les membres d’équipes de secours. Le coin dégagé montre un amas d’engrenages, de lames de labourage, de fers à cheval et de roues de chariot abîmés par le temps. La structure, en état de détérioration, est maintenue par des poutres en acier inoxydable, représentant le travail de sauvetage et le soutien assurés par les pompiers. La plupart des matériaux utilisés pour la structure ont été recyclés, y compris les objets perdus, qui proviennent en grande partie de vieilles fermes situées dans les collines de la Gatineau et dans les régions avoisinantes. Le panneau en cuivre symbolise l’image de la recherche et du sauvetage en milieu urbain, un avertissement aux équipes de secours qui pénètrent dans un bâtiment. Cette sculpture est un rappel monumental quant aux risques que prennent les services d’incendie et quant à l’importance que revêtent les services d’incendie.

La réalisation de ce projet a été possible grâce au soutien et à l’aide du Service des incendies d’Ottawa.",PA133,https://ottawa.ca/sites/default/files/images/featured/2013-0068b.jpg,https://ottawa.ca/sites/default/files/images/featured/2013-0068b.jpg,,45.253397,-75.736022,3559 Greenbank Rd,"3559, ch Greenbank",Collapse,Collapse,"Kinghorn, Michael","3559 Greenbank Road, Barrhaven South, Fire Station 47","3559 Greenbank Road, Barrhaven South, Fire Station 47",Ottawa,ON,20210118,"steel, stainless steel and copper","acier, acier inoxydable et cuivre",2012,147
-8452544.37303968,5675285.84308891,2013-0069,,"Chase is a sculptural installation in bronze, mapping the trail of a red fox chasing a ball. Chase captures the animal in gestural movements as though stopped in motion, offering the viewer a sustained gaze of something that usually unfolds too fast for the human eye to perceive.

Chase conveys athletic grace and beauty rooted in our fluid and ever changing connection to the natural world.  This artwork encourages a closer and more active connection to art, animals, activity and our shared environments through the development of an ongoing interactive relationship with the piece.

Erin Robertson and Anna Williams use conceptual and visual elements to provide an energizing and lyrical addition to the space as it draws on the regional environment and the Complex’s proximity to Trillium Woods.","La Chasse est une sculpture de bronze représentant le parcours d’un renard roux poursuivant une balle. La Chasse reproduit la gestuelle de l’animal interrompu dans son mouvement, offrant à l’observateur une vue soutenue sur une action habituellement trop rapide pour être perçu par l’œil humain.

La Chasse communique la grâce et la beauté athlétiques enracinées dans notre relation fluctuante et en perpétuel changement avec le monde naturel. Cette œuvre favorise des relations plus étroites et plus actives avec l’art, les animaux, l’activité et nos environnements partagés, en créant un lien interactif continu avec le sujet.

Robertson et Williams font appel à des éléments conceptuels et visuels pour apporter une touche énergisante et lyrique à l’espace, qui s’étend à l’environnement régional et au boisé Trillium, situé à proximité du Complexe.",PA134,https://ottawa.ca/sites/default/files/images/featured/chase_2.jpg,https://ottawa.ca/sites/default/files/images/featured/chase_2.jpg,,45.340496,-75.930498,4101 Innovation Dr,"4101, prom Innovation",Chase,La chasse,Erin Robertson and Anna Williams  ,"4101 Innovation Drive, Richcraft Recreation Complex (commissions)","4101 Innovation Drive, Richcraft Recreation Complex (commissions)",Ottawa,ON,20210118,bronze and stainless steel,bronze et acier inoxydable,2011,148
-8452544.37303968,5675285.84308891,2013-0073,,"Silver Line is a three part installation consisting of a pair of binoculars, a cloud fabricated in aluminum and stainless steel, and a poised bronze female gure. The three sculptural components come into alignment when viewed through the binoculars. The cloud appears to float at the figure’s fingertips, enveloped by the steam released from the building ventilation chimneys. Silver Line draws inspiration from the patterned choreography of ‘Cloud Hands’, a t’ai chi movement which incorporates a rolling, sweeping motion of the arms and hands in a graceful gesture. The artwork is suggestive of weather phenomena, and makes reference to the human connection to nature that is expressed through recreational activity. ","Ligne argentée est une installation en trois parties composée de jumelles, d’un nuage en aluminium et en acier inoxydable et d’un bronze représentant le corps d’une femme en équilibre. Vues à travers les jumelles, les trois composantes sculpturales s’alignent. Le nuage semble otter au bout des doigts de la femme, enveloppés par la vapeur qui s’échappe des cheminées de ventilation du bâtiment. L’oeuvre intitulée Ligne argentée s’inspire de la chorégraphie structurée du mouvement de taï chi « mouvoir les mains comme les nuages », geste gracieux de balayage par ondulation des bras et des mains. Elle évoque un phénomène météorologique et renvoie au lien entre l’humain et la nature qui s’exprime au moyen d’une activité de loisir.",PA301,https://ottawa.ca/sites/default/files/images/featured/2013-0073.jpg,https://ottawa.ca/sites/default/files/images/featured/2013-0073.jpg,,45.340496,-75.930498,4101 Innovation Dr,"4101, prom Innovation",Silver Line,Ligne argentée,"Lasserre, Maskull","4101 Innovation Drive, Richcraft Recreation Complex (commissions)","4101 Innovation Drive, Richcraft Recreation Complex (commissions)",Ottawa,ON,20210118,"stainless steel, aluminum, bronze and prefabricated components","acier inoxydable, aluminium, bronze et éléments préfabriqués",2011,149
-8452544.37303968,5675285.84308891,2013-0081,,"This sculptural installation was inspired by skiffs - long, slender boats with hulls so elongated that rowers balance themselves as though on a high wire. They speed forward so fast they barely touch the surface of the water. The long oars seem to walk on the water like the legs of a strange insect. Suspended above our heads in the lobby of the recreation complex, the two sculptures move across the space, evoking thoughts of water bugs and ying shes.

The artist was born on a small island and spent his childhood by the sea. The maritime landscape and culture forged his view of the world and continue to serve as the inspiration for his artistic practice.

Skiff was produced in collaboration with Forge ornementale Lapointe.","Cette oeuvre est inspirée des skiffs, embarcations aux coques effilées sur lesquelles les rameurs se tiennent en équilibre comme sur un fil tendu. Ils se déplacent ainsi à toute allure, effleurant à peine la surface de l'eau. Les longues rames semblent marcher sur l'eau comme les pattes d'un étrange insecte. Suspendues au dessus de nos têtes dans le hall d'entrée du complexe récréatif, les deux sculptures en forme de skiffs traversent l'espace et font penser à punaises d’eau ou à des poissons volants. 

L'artiste est né sur une petite île et a vécu son enfance au bord de la mer. Le paysage et la culture maritimes ont forgé son regard sur le monde et continuent d'agir comme toile de fond de sa pratique artistique. 

Skiff a été réalisé en collaboration avec la Forge ornementale Lapointe.",PA302,https://ottawa.ca/sites/default/files/images/featured/2013-0081.jpg,https://ottawa.ca/sites/default/files/images/featured/2013-0081.jpg,,45.340496,-75.930498,4101 Innovation Dr,"4101, prom Innovation",Skiff,Skiff,"Vigneau, Jean-Yves","4101 Innovation Drive, Richcraft Recreation Complex (commissions)","4101 Innovation Drive, Richcraft Recreation Complex (commissions)",Ottawa,ON,20210118,aluminum,aluminium,2011,150
-8452544.37303968,5675285.84308891,2013-0082,,"A Flat and a Box has two main components: a flat area and a rectangular box. Skaters use the sculpture for many different tricks and approaches – the design accommodates beginner to expert skaters.

Artists Alisdair MacRae and Negar Seyfollahy worked directly with skaters, the Ottawa Skateboard Community Association and New Line Skateparks Inc. to design the sculpture. Dimensions and materials were influenced by these key groups. A Flat and a Box and the skate plaza opened to the public in July 2014.","Cette œuvre compte deux éléments fondamentaux : une partie plane et une boîte rectangulaire. Les planchistes utilisent la sculpture pour de nombreuses figures et approches – sa conception convient tant aux novices qu'aux planchistes aguerris.

Pour la conception de la sculpture, les artistes Alisdair MacRae et Negar Seyfollahy ont travaillé directement avec des planchistes, l'Ottawa Skateboard Community Association et la société New Line Skateparks Inc. Ces groupes clés ont eu leur mot à dire sur les dimensions et les matériaux. Une plane et une boîte et le parc de planche à roulettes sont accessibles au public depuis juillet 2014.",PA303,https://ottawa.ca/sites/default/files/images/featured/2013-0082.jpg,https://ottawa.ca/sites/default/files/images/featured/2013-0082.jpg,,45.340496,-75.930498,4101 Innovation Dr,"4101, prom Innovation",A Flat and A Box,A Flat and A Box,,"4101 Innovation Drive, Richcraft Recreation Complex (commissions)","4101 Innovation Drive, Richcraft Recreation Complex (commissions)",Ottawa,ON,20210118,granite and cement,granit et ciment,2012,151
